{
  "schema_version": "0.3.0",
  "data_basis": "DESIGN",
  "source_refs": [
    "DESIGN-V03"
  ],
  "numeric_values_status": "합성 개발용 값. 현실 가격·운송일·직원 생산성 추정치가 아님.",
  "items": [
    {
      "id": "ROUTE01",
      "from_city_id": "BUSAN",
      "to_city_id": "YOKOHAMA",
      "direction": "one_way",
      "transit_days": 5,
      "map_waypoints": {
        "basis": "DESIGN",
        "use": "map_display_only",
        "note_ko": "지도에 그릴 바닷길 표시용 꺾은선. 실제 항로·항해 거리·운항 자료가 아니며 운송시간은 transit_days만 따른다.",
        "points": [
          {
            "lat": 35.1,
            "lon": 129.0
          },
          {
            "lat": 34.3,
            "lon": 129.15
          },
          {
            "lat": 33.0,
            "lon": 129.0
          },
          {
            "lat": 31.6,
            "lon": 129.6
          },
          {
            "lat": 30.8,
            "lon": 130.8
          },
          {
            "lat": 31.3,
            "lon": 132.0
          },
          {
            "lat": 32.5,
            "lon": 132.7
          },
          {
            "lat": 33.0,
            "lon": 134.4
          },
          {
            "lat": 33.25,
            "lon": 135.9
          },
          {
            "lat": 34.2,
            "lon": 137.5
          },
          {
            "lat": 34.45,
            "lon": 138.8
          },
          {
            "lat": 34.9,
            "lon": 139.55
          },
          {
            "lat": 35.2,
            "lon": 139.72
          },
          {
            "lat": 35.4,
            "lon": 139.6
          }
        ]
      },
      "departure_interval_days": 7,
      "first_departure_day": 2,
      "capacity_kg": 5000,
      "capacity_m3": 30,
      "booking_fee": {
        "currency": "USD",
        "amount": 200,
        "basis": "per_shipment_reserved_capacity_fixture"
      },
      "allowed_storage_classes": [
        "dry",
        "refrigerated"
      ],
      "carrier_id": "CARRIER_DEMO",
      "source_refs": [
        "DESIGN-V03"
      ]
    },
    {
      "id": "ROUTE02",
      "from_city_id": "BUSAN",
      "to_city_id": "SHANGHAI",
      "direction": "one_way",
      "transit_days": 4,
      "departure_interval_days": 7,
      "first_departure_day": 2,
      "capacity_kg": 5000,
      "capacity_m3": 30,
      "booking_fee": {
        "currency": "USD",
        "amount": 180,
        "basis": "per_shipment_reserved_capacity_fixture"
      },
      "allowed_storage_classes": [
        "dry",
        "refrigerated"
      ],
      "carrier_id": "CARRIER_DEMO",
      "source_refs": [
        "DESIGN-V03"
      ],
      "map_waypoints": {
        "basis": "DESIGN",
        "use": "map_display_only",
        "note_ko": "지도에 그릴 바닷길 표시용 꺾은선. 실제 항로·항해 거리·운항 자료가 아니며 운송시간은 transit_days만 따른다.",
        "points": [
          {
            "lat": 35.1,
            "lon": 129.0
          },
          {
            "lat": 34.6,
            "lon": 128.75
          },
          {
            "lat": 34.0,
            "lon": 128.0
          },
          {
            "lat": 33.1,
            "lon": 127.2
          },
          {
            "lat": 32.8,
            "lon": 126.2
          },
          {
            "lat": 32.3,
            "lon": 124.6
          },
          {
            "lat": 31.7,
            "lon": 123.1
          },
          {
            "lat": 31.35,
            "lon": 122.2
          },
          {
            "lat": 31.25,
            "lon": 121.75
          },
          {
            "lat": 31.2,
            "lon": 121.5
          }
        ]
      }
    },
    {
      "id": "ROUTE03",
      "from_city_id": "SHANGHAI",
      "to_city_id": "SINGAPORE",
      "direction": "one_way",
      "transit_days": 10,
      "departure_interval_days": 10,
      "first_departure_day": 2,
      "capacity_kg": 5000,
      "capacity_m3": 30,
      "booking_fee": {
        "currency": "USD",
        "amount": 350,
        "basis": "per_shipment_reserved_capacity_fixture"
      },
      "allowed_storage_classes": [
        "dry",
        "refrigerated"
      ],
      "carrier_id": "CARRIER_DEMO",
      "source_refs": [
        "DESIGN-V03"
      ]
    },
    {
      "id": "ROUTE04",
      "from_city_id": "HAIPHONG",
      "to_city_id": "SINGAPORE",
      "direction": "one_way",
      "transit_days": 8,
      "departure_interval_days": 7,
      "first_departure_day": 2,
      "capacity_kg": 5000,
      "capacity_m3": 30,
      "booking_fee": {
        "currency": "USD",
        "amount": 300,
        "basis": "per_shipment_reserved_capacity_fixture"
      },
      "allowed_storage_classes": [
        "dry",
        "refrigerated"
      ],
      "carrier_id": "CARRIER_DEMO",
      "source_refs": [
        "DESIGN-V03"
      ]
    },
    {
      "id": "ROUTE05",
      "from_city_id": "SINGAPORE",
      "to_city_id": "JAKARTA",
      "direction": "one_way",
      "transit_days": 4,
      "departure_interval_days": 7,
      "first_departure_day": 2,
      "capacity_kg": 5000,
      "capacity_m3": 30,
      "booking_fee": {
        "currency": "USD",
        "amount": 160,
        "basis": "per_shipment_reserved_capacity_fixture"
      },
      "allowed_storage_classes": [
        "dry",
        "refrigerated"
      ],
      "carrier_id": "CARRIER_DEMO",
      "source_refs": [
        "DESIGN-V03"
      ]
    },
    {
      "id": "ROUTE06",
      "from_city_id": "BUSAN",
      "to_city_id": "SINGAPORE",
      "direction": "one_way",
      "transit_days": 12,
      "departure_interval_days": 10,
      "first_departure_day": 2,
      "capacity_kg": 5000,
      "capacity_m3": 30,
      "booking_fee": {
        "currency": "USD",
        "amount": 450,
        "basis": "per_shipment_reserved_capacity_fixture"
      },
      "allowed_storage_classes": [
        "dry",
        "refrigerated"
      ],
      "carrier_id": "CARRIER_DEMO",
      "source_refs": [
        "DESIGN-V03"
      ]
    }
  ],
  "$schema": "../schemas/routes.schema.json"
}
